{
 "schema_version": 1,
 "match_id": "NBA-HCF-7",
 "profile": "casual",
 "favourite": null,
 "items": [
  {
   "id": "NBA-HCF-7:casual:all:ticker:kickoff",
   "match_id": "NBA-HCF-7",
   "profile": "casual",
   "lang": "en",
   "at_event": 1,
   "period": 1,
   "clock": 0.0,
   "display_clock": "1'",
   "show_for_s": 4.0,
   "slot": "ticker",
   "kind": "kickoff",
   "text": "We're under way: Northbridge Athletic v Harbor City FC!",
   "translations": {
    "es": {
     "text": "We're under way: Northbridge Athletic v Harbor City FC!",
     "ok": false
    }
   },
   "fact_ids": [
    "kickoff"
   ],
   "evidence": [
    1
   ],
   "source": "template",
   "blocked": [],
   "boost": false
  },
  {
   "id": "NBA-HCF-7:casual:all:ticker:moment-34",
   "match_id": "NBA-HCF-7",
   "profile": "casual",
   "lang": "en",
   "at_event": 34,
   "period": 1,
   "clock": 102.4,
   "display_clock": "2'",
   "show_for_s": 4.0,
   "slot": "ticker",
   "kind": "big_chance_missed",
   "text": "So close! Milo Galbraith should have scored for Harbor City FC.",
   "translations": {
    "es": {
     "text": "So close! Milo Galbraith should have scored for Harbor City FC.",
     "ok": false
    }
   },
   "fact_ids": [
    "moment-34"
   ],
   "evidence": [
    34
   ],
   "source": "template",
   "blocked": [],
   "boost": false
  },
  {
   "id": "NBA-HCF-7:casual:all:alert:moment-254",
   "match_id": "NBA-HCF-7",
   "profile": "casual",
   "lang": "en",
   "at_event": 254,
   "period": 1,
   "clock": 804.1,
   "display_clock": "14'",
   "show_for_s": 6.0,
   "slot": "alert",
   "kind": "goal",
   "text": "What a moment! Finn Holloway scores for Northbridge Athletic! Northbridge Athletic 1-0 Harbor City FC.",
   "translations": {
    "es": {
     "text": "What a moment! Finn Holloway scores for Northbridge Athletic! Northbridge Athletic 1-0 Harbor City FC.",
     "ok": false
    }
   },
   "fact_ids": [
    "moment-254"
   ],
   "evidence": [
    252,
    253,
    254
   ],
   "source": "template",
   "blocked": [],
   "boost": false
  },
  {
   "id": "NBA-HCF-7:casual:all:ticker:moment-423",
   "match_id": "NBA-HCF-7",
   "profile": "casual",
   "lang": "en",
   "at_event": 423,
   "period": 1,
   "clock": 1433.1,
   "display_clock": "24'",
   "show_for_s": 4.0,
   "slot": "ticker",
   "kind": "save",
   "text": "Great save by Pavel Selbourne! Cal Fairbank is denied.",
   "translations": {
    "es": {
     "text": "Great save by Pavel Selbourne! Cal Fairbank is denied.",
     "ok": false
    }
   },
   "fact_ids": [
    "moment-423"
   ],
   "evidence": [
    422,
    423
   ],
   "source": "template",
   "blocked": [],
   "boost": false
  },
  {
   "id": "NBA-HCF-7:casual:all:ticker:moment-475",
   "match_id": "NBA-HCF-7",
   "profile": "casual",
   "lang": "en",
   "at_event": 475,
   "period": 1,
   "clock": 1623.3,
   "display_clock": "28'",
   "show_for_s": 4.0,
   "slot": "ticker",
   "kind": "save",
   "text": "Great save by Pavel Selbourne! Dario Langstone is denied.",
   "translations": {
    "es": {
     "text": "Great save by Pavel Selbourne! Dario Langstone is denied.",
     "ok": false
    }
   },
   "fact_ids": [
    "moment-475"
   ],
   "evidence": [
    474,
    475
   ],
   "source": "template",
   "blocked": [],
   "boost": false
  },
  {
   "id": "NBA-HCF-7:casual:all:ticker:moment-580",
   "match_id": "NBA-HCF-7",
   "profile": "casual",
   "lang": "en",
   "at_event": 580,
   "period": 1,
   "clock": 1977.2,
   "display_clock": "33'",
   "show_for_s": 4.0,
   "slot": "ticker",
   "kind": "big_chance_missed",
   "text": "So close! Kai Underhill should have scored for Northbridge Athletic.",
   "translations": {
    "es": {
     "text": "So close! Kai Underhill should have scored for Northbridge Athletic.",
     "ok": false
    }
   },
   "fact_ids": [
    "moment-580"
   ],
   "evidence": [
    580
   ],
   "source": "template",
   "blocked": [],
   "boost": false
  },
  {
   "id": "NBA-HCF-7:casual:all:alert:moment-688",
   "match_id": "NBA-HCF-7",
   "profile": "casual",
   "lang": "en",
   "at_event": 688,
   "period": 1,
   "clock": 2292.4,
   "display_clock": "39'",
   "show_for_s": 6.0,
   "slot": "alert",
   "kind": "yellow_card",
   "text": "Booked: Milo Upworth of Northbridge Athletic.",
   "translations": {
    "es": {
     "text": "Booked: Milo Upworth of Northbridge Athletic.",
     "ok": false
    }
   },
   "fact_ids": [
    "moment-688"
   ],
   "evidence": [
    687,
    688
   ],
   "source": "template",
   "blocked": [],
   "boost": false
  },
  {
   "id": "NBA-HCF-7:casual:all:alert:moment-794",
   "match_id": "NBA-HCF-7",
   "profile": "casual",
   "lang": "en",
   "at_event": 794,
   "period": 1,
   "clock": 2678.5,
   "display_clock": "45'",
   "show_for_s": 6.0,
   "slot": "alert",
   "kind": "goal",
   "text": "It's in! Jonah Haldane scores for Northbridge Athletic! Northbridge Athletic 2-0 Harbor City FC.",
   "translations": {
    "es": {
     "text": "It's in! Jonah Haldane scores for Northbridge Athletic! Northbridge Athletic 2-0 Harbor City FC.",
     "ok": false
    }
   },
   "fact_ids": [
    "moment-794"
   ],
   "evidence": [
    793,
    794
   ],
   "source": "template",
   "blocked": [],
   "boost": false
  },
  {
   "id": "NBA-HCF-7:casual:all:score:half-time",
   "match_id": "NBA-HCF-7",
   "profile": "casual",
   "lang": "en",
   "at_event": 803,
   "period": 1,
   "clock": 2767.2,
   "display_clock": "45+2'",
   "show_for_s": 4.0,
   "slot": "score",
   "kind": "half_time",
   "text": "Half-time: Northbridge Athletic 2-0 Harbor City FC.",
   "translations": {
    "es": {
     "text": "Half-time: Northbridge Athletic 2-0 Harbor City FC.",
     "ok": false
    }
   },
   "fact_ids": [
    "half-time"
   ],
   "evidence": [
    254,
    794,
    803
   ],
   "source": "template",
   "blocked": [],
   "boost": false
  },
  {
   "id": "NBA-HCF-7:casual:all:stats:swing-30",
   "match_id": "NBA-HCF-7",
   "profile": "casual",
   "lang": "en",
   "at_event": 804,
   "period": 2,
   "clock": 0.0,
   "display_clock": "46'",
   "show_for_s": 4.0,
   "slot": "stats",
   "kind": "momentum_swing",
   "text": "Northbridge Athletic are on top now and pushing forward.",
   "translations": {
    "es": {
     "text": "Northbridge Athletic are on top now and pushing forward.",
     "ok": false
    }
   },
   "fact_ids": [
    "swing-30"
   ],
   "evidence": [
    580,
    684,
    793
   ],
   "source": "template",
   "blocked": [],
   "boost": false
  },
  {
   "id": "NBA-HCF-7:casual:all:ticker:moment-910",
   "match_id": "NBA-HCF-7",
   "profile": "casual",
   "lang": "en",
   "at_event": 910,
   "period": 2,
   "clock": 355.5,
   "display_clock": "51'",
   "show_for_s": 4.0,
   "slot": "ticker",
   "kind": "save",
   "text": "Great save by Pavel Selbourne! Cal Fairbank is denied.",
   "translations": {
    "es": {
     "text": "Great save by Pavel Selbourne! Cal Fairbank is denied.",
     "ok": false
    }
   },
   "fact_ids": [
    "moment-910"
   ],
   "evidence": [
    909,
    910
   ],
   "source": "template",
   "blocked": [],
   "boost": false
  },
  {
   "id": "NBA-HCF-7:casual:all:alert:moment-1010",
   "match_id": "NBA-HCF-7",
   "profile": "casual",
   "lang": "en",
   "at_event": 1010,
   "period": 2,
   "clock": 651.1,
   "display_clock": "56'",
   "show_for_s": 6.0,
   "slot": "alert",
   "kind": "yellow_card",
   "text": "Booked: Jonah Haldane of Northbridge Athletic.",
   "translations": {
    "es": {
     "text": "Booked: Jonah Haldane of Northbridge Athletic.",
     "ok": false
    }
   },
   "fact_ids": [
    "moment-1010"
   ],
   "evidence": [
    1009,
    1010
   ],
   "source": "template",
   "blocked": [],
   "boost": false
  },
  {
   "id": "NBA-HCF-7:casual:all:ticker:moment-1035",
   "match_id": "NBA-HCF-7",
   "profile": "casual",
   "lang": "en",
   "at_event": 1035,
   "period": 2,
   "clock": 740.4,
   "display_clock": "58'",
   "show_for_s": 4.2,
   "slot": "ticker",
   "kind": "substitution",
   "text": "Change for Harbor City FC: Theo Gorsuch comes on for Ivo Dunmore.",
   "translations": {
    "es": {
     "text": "Change for Harbor City FC: Theo Gorsuch comes on for Ivo Dunmore.",
     "ok": false
    }
   },
   "fact_ids": [
    "moment-1035"
   ],
   "evidence": [
    1035
   ],
   "source": "template",
   "blocked": [],
   "boost": false
  },
  {
   "id": "NBA-HCF-7:casual:all:ticker:moment-1082",
   "match_id": "NBA-HCF-7",
   "profile": "casual",
   "lang": "en",
   "at_event": 1082,
   "period": 2,
   "clock": 894.6,
   "display_clock": "60'",
   "show_for_s": 4.0,
   "slot": "ticker",
   "kind": "substitution",
   "text": "Change for Northbridge Athletic: Mateo Ingram comes on for Luca Brennick.",
   "translations": {
    "es": {
     "text": "Change for Northbridge Athletic: Mateo Ingram comes on for Luca Brennick.",
     "ok": false
    }
   },
   "fact_ids": [
    "moment-1082"
   ],
   "evidence": [
    1082
   ],
   "source": "template",
   "blocked": [],
   "boost": false
  },
  {
   "id": "NBA-HCF-7:casual:all:stats:swing-45",
   "match_id": "NBA-HCF-7",
   "profile": "casual",
   "lang": "en",
   "at_event": 1083,
   "period": 2,
   "clock": 928.8,
   "display_clock": "61'",
   "show_for_s": 4.0,
   "slot": "stats",
   "kind": "momentum_swing",
   "text": "Harbor City FC are on top now and pushing forward.",
   "translations": {
    "es": {
     "text": "Harbor City FC are on top now and pushing forward.",
     "ok": false
    }
   },
   "fact_ids": [
    "swing-45"
   ],
   "evidence": [
    886,
    909,
    971
   ],
   "source": "template",
   "blocked": [],
   "boost": false
  },
  {
   "id": "NBA-HCF-7:casual:all:alert:moment-1120",
   "match_id": "NBA-HCF-7",
   "profile": "casual",
   "lang": "en",
   "at_event": 1120,
   "period": 2,
   "clock": 1044.7,
   "display_clock": "63'",
   "show_for_s": 6.0,
   "slot": "alert",
   "kind": "goal",